{
  "kind": "template",
  "name": "default",
  "family": "markdown",
  "version": "0.1.0",
  "source": "hand-authored",
  "description": "General prompt scaffold (Goal/Context/Approach/Output) for skill-driven research and investigation tasks. Static skeleton — placeholders use angle-bracket prose, not mustache-lite slots.",
  "slots": []
}
