{
  "kind": "template",
  "name": "prototype-animation",
  "family": "html",
  "version": "0.1.0",
  "source": "html-effectiveness:07-prototype-animation.html",
  "description": "Standalone HTML animation prototype: a replayable completion micro-interaction with an easing-curve switcher and the copy-paste CSS that drives it. Interactive template — carries the interactive-template minimal-JS exception: self-contained inline JS replays the animation and swaps the easing curve, with no external resources.",
  "slots": [
    { "key": "title", "type": "string", "description": "Prototype title; used in <title> and the h1." },
    { "key": "stage", "type": "string", "description": "The animated demo element region; the prototype markup whose transitions are being shown." },
    { "key": "easings[]", "type": "easing", "description": "One .ease-btn per easing option; the demo swaps --ease to the button's data-ease. See shape." },
    { "key": "cssSnippet", "type": "string", "description": "Copy-paste CSS that reproduces the animation." },
    { "key": "provenance", "type": "string", "required": false, "description": "Footer provenance line, auto-filled by the agent." }
  ],
  "shape": {
    "easings[]": "{ name: string, curve: string (a CSS timing function, e.g. cubic-bezier(.16,1,.3,1)) }"
  }
}
