{
  "kind": "template",
  "name": "minimal",
  "family": "markdown",
  "version": "0.1.0",
  "source": "hand-authored",
  "description": "Minimal spec markdown skeleton (frontmatter + Scope/Non-goals/Open-Questions) for the brainstorm-spec skill. Static skeleton — placeholders use angle-bracket prose, not mustache-lite slots.",
  "slots": []
}
