{
  "kind": "template",
  "name": "default",
  "family": "markdown",
  "version": "0.1.0",
  "source": "hand-authored",
  "description": "ADR ticket skeleton (ADR-NNNN: context, decision, alternatives, consequences) consumed by the brainstorm-spec skill's adr fragment. Static skeleton — placeholders use angle-bracket prose, not mustache-lite slots.",
  "slots": []
}
