{
  "kind": "template",
  "name": "default",
  "family": "markdown",
  "version": "0.1.0",
  "source": "hand-authored",
  "description": "Severity taxonomy and findings-structure skeleton for the code-review skill. Static skeleton — no mustache-lite slots; the agent emits findings into the fixed section headings.",
  "slots": []
}
